{
  "expiryDate" : "2022-08-20",
  "disposerNumber" : "S30A00065",
  "auditorAddress" : {
    "locality" : {
      "value" : "Mannheim",
      "technicalKey" : "BLOCK"
    },
    "country" : {
      "shortName" : ""
    },
    "postCode" : {
      "value" : "68161\\12",
      "technicalKey" : "CEDEX"
    },
    "thoroughfare" : {
      "value" : "Bernstraße",
      "number" : "45",
      "technicalKey" : "STREET"
    },
    "premise" : {
      "value" : "Werk 1",
      "technicalKey" : "BUILDING"
    },
    "postalDeliveryPoint" : {
      "value" : "Tor 1",
      "technicalKey" : "INTERURBAN_DELIVERY_POINT"
    }
  },
  "governmentAddress" : {
    "locality" : {
      "value" : "Mannheim",
      "technicalKey" : "BLOCK"
    },
    "country" : {
      "shortName" : ""
    },
    "postCode" : {
      "value" : "68161\\12",
      "technicalKey" : "CEDEX"
    },
    "thoroughfare" : {
      "value" : "Bernstraße",
      "number" : "45",
      "technicalKey" : "STREET"
    },
    "premise" : {
      "value" : "Werk 1",
      "technicalKey" : "BUILDING"
    },
    "postalDeliveryPoint" : {
      "value" : "Tor 1",
      "technicalKey" : "INTERURBAN_DELIVERY_POINT"
    }
  },
  "dismantlerContact" : {
    "faxNumber" : "+49 89 0987654321",
    "website" : "https://www.samsung.com",
    "phoneNumber" : "+49 89 1234567890",
    "email" : "test.mail@example.com"
  },
  "auditorContact" : {
    "faxNumber" : "+49 89 0987654321",
    "website" : "https://www.samsung.com",
    "phoneNumber" : "+49 89 1234567890",
    "email" : "test.mail@example.com"
  },
  "certificateNumber" : "02397421FG",
  "carrierIdentification" : "S30T00026",
  "dismantlerAddress" : {
    "locality" : {
      "value" : "Mannheim",
      "technicalKey" : "BLOCK"
    },
    "country" : {
      "shortName" : ""
    },
    "postCode" : {
      "value" : "68161\\12",
      "technicalKey" : "CEDEX"
    },
    "thoroughfare" : {
      "value" : "Bernstraße",
      "number" : "45",
      "technicalKey" : "STREET"
    },
    "premise" : {
      "value" : "Werk 1",
      "technicalKey" : "BUILDING"
    },
    "postalDeliveryPoint" : {
      "value" : "Tor 1",
      "technicalKey" : "INTERURBAN_DELIVERY_POINT"
    }
  },
  "producerNumber" : "S30E00529",
  "issueDate" : "2021-08-20"
}